{
  "cycle_id": "2026-08-12-evidence-profile-adapter",
  "started_at": "2026-08-12T08:15:51+08:00",
  "starting_research_sha": "f426cfb8f8d0f8a8411d674b368537cbcc3509fe",
  "research_question": "Can AION/Astra lineage-local evidence profiles be bound back to the standing whitepaper-derived evidence architecture without becoming a second subjectivity ontology or scoring system?",
  "epistemic_role": "MEASUREMENT",
  "source_refs": [
    "research-workbench/four-domain-materialization/2026-08-11/EVIDENCE_ARCHITECTURE_GOVERNANCE_RECONCILIATION_2026-08-11.md",
    "research-workbench/four-domain-materialization/2026-08-11/RESEARCH_SCOPE_LOCK_2026-08-11.json",
    "research-labs/shared-origin-divergence-governance_v0.1.0/src/aion_shared_origin_divergence/model.py"
  ],
  "changed_paths": [
    "research-labs/shared-origin-divergence-governance_v0.1.0/src/aion_shared_origin_divergence/evidence_adapter.py",
    "research-labs/shared-origin-divergence-governance_v0.1.0/tests/test_evidence_adapter.py",
    "research-workbench/autonomous-growth/AUTONOMOUS_GROWTH_LEDGER.md",
    "research-workbench/autonomous-growth/cycles/2026-08-12-evidence-profile-adapter.json"
  ],
  "validation": {
    "commands": [
      "python -m pytest -q (planned in research-labs/shared-origin-divergence-governance_v0.1.0)",
      "git clone --depth 1 --branch autogrow/2026-08-12-evidence-profile-adapter https://github.com/maker-luder/aion-governance-framework.git /tmp/aion-autogrow"
    ],
    "outcomes": [
      "LOCAL_VALIDATION_BLOCKED: execution environment could not resolve github.com, so repository checkout and pytest could not be completed",
      "GITHUB_COMMIT_STATUS_UNAVAILABLE: no status contexts were present on candidate head at review time"
    ]
  },
  "result_class": "INCONCLUSIVE",
  "candidate_branch": "autogrow/2026-08-12-evidence-profile-adapter",
  "integration_status": "HOLD",
  "hold_items": [
    "Focused pytest validation has not executed in an environment with repository checkout access",
    "Research Scope Lock and Research Workbench CI have not produced candidate-head status contexts",
    "Do not merge until focused tests and relevant scope/CI gates are green"
  ]
}
